{
  "$schema": "https://json-schema.org/draft/2020-12/schema",
  "$id": "https://just-ledger.dev/contracts/statement-record.schema.json",
  "title": "statement_record",
  "description": "정규화된 명세서 레코드 — Rust WASM 파서의 출력이자 골든 픽스처 기대 형식. 클라이언트 전용 산물이다: description/counterparty 가 포함된 이 형태는 절대 평문으로 서버에 전송·저장되지 않는다 (INV-6). 서버로 가는 것은 ingest-payload 의 최소 필드 + 암호화 blob 뿐.",
  "type": "object",
  "additionalProperties": false,
  "required": ["source_hash", "occurred_on", "amount_minor", "currency", "description"],
  "properties": {
    "source_hash": {
      "description": "BLAKE3(normalize(일시) ‖ amount_minor ‖ normalize(상대처) ‖ 동일튜플 발생순번). 순번은 같은 파일 내 정당한 중복 거래(같은 날 같은 가게 같은 금액)의 유실을 막고, 재업로드 시에도 결정론적이라 중복 제거를 유지한다.",
      "type": "string",
      "pattern": "^[0-9a-f]{64}$"
    },
    "occurred_on": { "$ref": "common.schema.json#/$defs/date" },
    "occurred_time": {
      "description": "명세서에 시각이 있으면 HH:MM:SS. 지문 정규화에 사용되며 표시용으로도 쓰인다.",
      "type": "string",
      "pattern": "^[0-2][0-9]:[0-5][0-9]:[0-5][0-9]$"
    },
    "amount_minor": {
      "description": "부호 있는 최소 화폐 단위 정수 문자열. 출금(지출)은 음수, 입금은 양수.",
      "$ref": "common.schema.json#/$defs/moneyMinor"
    },
    "currency": { "$ref": "common.schema.json#/$defs/currency" },
    "description": {
      "description": "적요 (NFKC 정규화·공백 축약 후). 서버 평문 전송 금지.",
      "type": "string",
      "maxLength": 256
    },
    "counterparty": {
      "description": "상대처/의뢰인/수취인 (있는 포맷만). 서버 평문 전송 금지.",
      "oneOf": [
        { "type": "string", "maxLength": 256 },
        { "type": "null" }
      ]
    },
    "balance_minor": {
      "description": "거래 후 잔액 (명세서에 있으면). 검산용.",
      "oneOf": [
        { "$ref": "common.schema.json#/$defs/moneyMinor" },
        { "type": "null" }
      ]
    }
  }
}
